{
  "series": "PS",
  "serial": 900,
  "name": "Thundernub",
  "level": 47,
  "rarity": "LEGENDARY",
  "type": "STORM",
  "height_mm": 415,
  "weight_g": 2260,
  "strength": 88,
  "endurance": 71,
  "agility": 93,
  "happiness": 64,
  "art_id": 42,
  "style_id": 1,
  "frame_id": 4,
  "background_id": 19,
  "biome_id": 11,
  "mood_id": 6,
  "personality": "Grumpy meteorologist. Predicts drizzle, delivers spectacular chaos instead.",
  "power_name": "Barometric Grump",
  "power_desc": "Drops the pressure until rivals sulk, then detonates a violet thundercrack.",
  "quote": "Krrk-BOOM. (I did warn everybody.)",
  "mint_day": 400,
  "shiny": true,
  "flags": { "has_companion": false, "has_accessory": true, "verified": true, "on_chain": false, "seed": false },
  "art_sha": "1a2b3c4d",
  "biome": "Lightning Rod on a Barn",
  "companion": ""
}
