{
  "series": "PS",
  "serial": 1,
  "name": "Mochibo",
  "level": 12,
  "rarity": "EPIC",
  "type": "FAIRY",
  "height_mm": 280,
  "weight_g": 900,
  "strength": 28,
  "endurance": 55,
  "agility": 65,
  "happiness": 95,
  "art_id": 1,
  "style_id": 1,
  "frame_id": 3,
  "background_id": 7,
  "biome_id": 4,
  "mood_id": 2,
  "personality": "Sweet and cuddly. Loves cozy places and spreading joy!",
  "power_name": "Sugar Squish",
  "power_desc": "Covers the area in sweet goo, healing allies over time.",
  "quote": "Mochi! (Hugs all around!)",
  "mint_day": 208,
  "shiny": false,
  "flags": {
    "has_companion": true,
    "has_accessory": true,
    "verified": true,
    "on_chain": false,
    "seed": true
  },
  "art_sha": "00000000",
  "biome": "Cozy Reading Room",
  "companion": "Sleepy Puff Cat"
}
