{
  "series": "PS",
  "serial": 65535,
  "name": "Zzyxqvwuunthorp",
  "level": 100,
  "rarity": "MYTHIC",
  "type": "DREAM",
  "height_mm": 65535,
  "weight_g": 65535,
  "strength": 100,
  "endurance": 100,
  "agility": 100,
  "happiness": 100,
  "art_id": 255,
  "style_id": 255,
  "frame_id": 5,
  "background_id": 255,
  "biome_id": 255,
  "mood_id": 255,
  "personality": "Xylophone quandary; brusque wyvern-jockeys vex phlegmatic zookeepers nightly!!",
  "power_name": "Qwixjumble Fzzbang",
  "power_desc": "Zigzag quokkas jaunt vexingly; wharf-bound sphinxes gulp mycelium brandy quick",
  "quote": "Vwx?! (Zjq-phlm gxyzzy brrp!!)",
  "mint_day": 65535,
  "shiny": true,
  "flags": { "has_companion": true, "has_accessory": true, "verified": true, "on_chain": true, "seed": false },
  "art_sha": "ffffffff",
  "biome": "Nowhere In Particular",
  "companion": "An Idea"
}
